<?xml version="1.0" encoding="UTF-8"?>
<!DOCTYPE channel SYSTEM "5.dtd">
<channel version="">
    <item>
        <title></title>
        <link></link>
        <description></description>
    </item>
    <title></title>
    <link></link>
    <image>
        <title></title>
    </image>
    <language></language>
    <description></description>
</channel>